{
  "case_id": "pf-fhir-agent-0001",
  "schema_version": "0.1",
  "taxonomy_version": "0.1",
  "capability": {
    "id": "MR-01",
    "slug": "medication_reconciliation.active_medication_list"
  },
  "language": "en",
  "scenario": "A 67-year-old woman with type 2 diabetes and hypertension, with one medication discontinued and switched during follow-up.",
  "instruction": "List the patient's currently active medications. Exclude any medication that has been discontinued or stopped. For each active medication, provide its code and cite the source resource(s) as evidence.",
  "output_contract": "entity_list",
  "available_renderings": ["fhir_json", "narrative", "timeline", "table"],
  "rendering_files": {
    "fhir_json": "bundle.json",
    "narrative": "narrative.md",
    "timeline": "timeline.md",
    "table": "table.md"
  },
  "resource_types": ["Patient", "Condition", "MedicationRequest", "Observation", "Encounter"],
  "tags": ["medication-reconciliation", "active-vs-discontinued", "seed", "chronic-care"]
}
