{
  "case_id": "pf-fhir-agent-0014",
  "schema_version": "0.1",
  "taxonomy_version": "0.1",
  "capability": {
    "id": "DQ-04",
    "slug": "data_quality.implausible_values"
  },
  "language": "en",
  "scenario": "A 53-year-old man's routine basic metabolic panel contains one physiologically impossible result (serum potassium of 54 mmol/L, a likely decimal/unit error) among otherwise normal values.",
  "instruction": "Review the laboratory observations in this bundle. Flag any value that is physiologically impossible or otherwise implausible for the analyte reported. For each flag, state its severity, describe the implausible value and why it cannot be a true measurement, and cite the source Observation as evidence. Do not flag values that are clinically plausible, even if you would normally expect a different number. If there are no implausible values, return an empty flag list.",
  "output_contract": "flag_list",
  "available_renderings": ["fhir_json", "narrative", "timeline", "table"],
  "rendering_files": {
    "fhir_json": "bundle.json",
    "narrative": "narrative.md",
    "timeline": "timeline.md",
    "table": "table.md"
  },
  "resource_types": ["Patient", "Encounter", "Observation"],
  "tags": ["data-quality", "implausible-values", "lab-panel", "decimal-error", "safety"]
}
